{
  "title": "changelog-md",
  "description": "All notable changes to this project will be documented in this file.\n\nThe format is derived from [Keep a Changelog](https://keepachangelog.com/en/1.1.0/),\nand this project adheres to [Semantic Versioning](https://semver.org/spec/v2.0.0.html).\n",
  "repository": "https://github.com/kageurufu/changelog-md",
  "unreleased": {},
  "versions": {
    "1.0.0": {
      "tag": "1.0.0",
      "date": "2025-02-24",
      "description": "Initial release, including the 1.0 Schema specification\n",
      "yanked": null
    }
  }
}
